What's availability?,Availability ensures that authorized subjects are granted timely and uninterrupted access to objects.,"(ISC)2 CISSP Certified Information Systems Security Professional Official Study Guide, 8th Edition",Mike Chapple...,Chapter 1 Security Governance Through Principles and Policies,https://www.safaribooksonline.com/library/view/isc2-cissp-certified/9781119475934/,https://www.safaribooksonline.com/library/view/isc2-cissp-certified/9781119475934/c01.xhtml,https://www.safaribooksonline.com/a/isc2-cissp-certified/23807931/,2019-03-01,9781119475934.jpg,,CISSP
What's nonrepudiation?,Nonrepudiation ensures that the subject of an activity or who caused an event cannot deny that the event occurred.,"(ISC)2 CISSP Certified Information Systems Security Professional Official Study Guide, 8th Edition",Mike Chapple...,Chapter 1 Security Governance Through Principles and Policies,https://www.safaribooksonline.com/library/view/isc2-cissp-certified/9781119475934/,https://www.safaribooksonline.com/library/view/isc2-cissp-certified/9781119475934/c01.xhtml,https://www.safaribooksonline.com/a/isc2-cissp-certified/23807783/,2019-03-01,9781119475934.jpg,,CISSP
What does integrity ensure?,"Integrity ensures that data remains correct, unaltered, and preserved.","(ISC)2 CISSP Certified Information Systems Security Professional Official Study Guide, 8th Edition",Mike Chapple...,Chapter 1 Security Governance Through Principles and Policies,https://www.safaribooksonline.com/library/view/isc2-cissp-certified/9781119475934/,https://www.safaribooksonline.com/library/view/isc2-cissp-certified/9781119475934/c01.xhtml,https://www.safaribooksonline.com/a/isc2-cissp-certified/23807683/,2019-03-01,9781119475934.jpg,,CISSP
What's an object?,"An object is the passive element in a security relationship, such as files, computers, network connections, and applications.","(ISC)2 CISSP Certified Information Systems Security Professional Official Study Guide, 8th Edition",Mike Chapple...,Chapter 1 Security Governance Through Principles and Policies,https://www.safaribooksonline.com/library/view/isc2-cissp-certified/9781119475934/,https://www.safaribooksonline.com/library/view/isc2-cissp-certified/9781119475934/c01.xhtml,https://www.safaribooksonline.com/a/isc2-cissp-certified/23807398/,2019-03-01,9781119475934.jpg,,CISSP
What's a subject?,"A subject is the active element in a security relationship, such as users, programs, and computers.","(ISC)2 CISSP Certified Information Systems Security Professional Official Study Guide, 8th Edition",Mike Chapple...,Chapter 1 Security Governance Through Principles and Policies,https://www.safaribooksonline.com/library/view/isc2-cissp-certified/9781119475934/,https://www.safaribooksonline.com/library/view/isc2-cissp-certified/9781119475934/c01.xhtml,https://www.safaribooksonline.com/a/isc2-cissp-certified/23807390/,2019-03-01,9781119475934.jpg,,CISSP
What's is the management of the relationship between subjects and objects known as?,Access control,"(ISC)2 CISSP Certified Information Systems Security Professional Official Study Guide, 8th Edition",Mike Chapple...,Chapter 1 Security Governance Through Principles and Policies,https://www.safaribooksonline.com/library/view/isc2-cissp-certified/9781119475934/,https://www.safaribooksonline.com/library/view/isc2-cissp-certified/9781119475934/c01.xhtml,https://www.safaribooksonline.com/a/isc2-cissp-certified/23807370/,2019-03-01,9781119475934.jpg,,CISSP
Where does encryption and access control belong in the CIA Triad?,Confidentiality,"(ISC)2 CISSP Certified Information Systems Security Professional Official Study Guide, 8th Edition",Mike Chapple...,Chapter 1 Security Governance Through Principles and Policies,https://www.safaribooksonline.com/library/view/isc2-cissp-certified/9781119475934/,https://www.safaribooksonline.com/library/view/isc2-cissp-certified/9781119475934/c01.xhtml,https://www.safaribooksonline.com/a/isc2-cissp-certified/23807342/,2019-03-01,9781119475934.jpg,9781119475934c01f001.jpg,CISSP
What's the goal of confidentiality protection?,To prevent or minimize unauthorized access to data,"(ISC)2 CISSP Certified Information Systems Security Professional Official Study Guide, 8th Edition",Mike Chapple...,Chapter 1 Security Governance Through Principles and Policies,https://www.safaribooksonline.com/library/view/isc2-cissp-certified/9781119475934/,https://www.safaribooksonline.com/library/view/isc2-cissp-certified/9781119475934/c01.xhtml,https://www.safaribooksonline.com/a/isc2-cissp-certified/23807306/,2019-03-01,9781119475934.jpg,,CISSP
What's the CIA Triad?,"Confidentiality, Integrity, and Availability (CIA)","(ISC)2 CISSP Certified Information Systems Security Professional Official Study Guide, 8th Edition",Mike Chapple...,Chapter 1 Security Governance Through Principles and Policies,https://www.safaribooksonline.com/library/view/isc2-cissp-certified/9781119475934/,https://www.safaribooksonline.com/library/view/isc2-cissp-certified/9781119475934/c01.xhtml,https://www.safaribooksonline.com/a/isc2-cissp-certified/23807270/,2019-03-01,9781119475934.jpg,9781119475934c01f001.jpg,CISSP
